{
  "schemaVersion": 1,
  "id": "wwdc2021-10022",
  "event": "wwdc2021",
  "eventName": "WWDC21",
  "year": 2021,
  "eventContentId": 10022,
  "title": "Demystify SwiftUI",
  "description": "Peek behind the curtain into the core tenets of SwiftUI philosophy: Identity, Lifetime, and Dependencies. Find out about common patterns, learn the principles that drive the framework, and discover how you can use them to guarantee correctness and performance for your app.",
  "url": "https://developer.apple.com/videos/play/wwdc2021/10022",
  "sosumiURL": "https://sosumi.ai/videos/play/wwdc2021/10022",
  "type": "Video",
  "publishedAt": "2021-06-09T06:00:00-07:00",
  "platforms": [
    "iOS",
    "iPadOS",
    "macOS",
    "tvOS",
    "watchOS"
  ],
  "keywords": [
    "🐈",
    "🐕",
    "🐩",
    "🐱",
    "🐲",
    "🐶",
    "🦄",
    "🦮",
    "🐈‍⬛",
    "🐕‍🦺",
    "action",
    "alert",
    "anyview",
    "bad dog",
    "@binding",
    "biscuit",
    "body",
    "body property",
    "branch",
    "cat",
    "confirmationdialog",
    "connecting views",
    "continuity over time",
    "data-driven constructs",
    "declarative",
    "dependencies",
    "dependency graph",
    "different identities",
    "dog",
    "dragon",
    "elements",
    "@environment",
    "@environmentobject",
    "explicit identifiers",
    "explicit identity",
    "foreach",
    "good dog",
    "graph",
    "grouchy cat",
    "happy cat",
    "how does swiftui update the ui",
    "identifiable",
    "identifiable protocol",
    "identifier map to single view",
    "identifier stability",
    "identifier uniqueness",
    "identity",
    "inert modifier",
    "lifetime",
    "list",
    "magical",
    "onappear",
    "ondisappear",
    "outlinegroup",
    "performance",
    "pretzel",
    "same identity",
    "stable identifiers",
    "stable identity",
    "state",
    "state lifetime",
    "stateobject",
    "structural identity",
    "swiftui",
    "switch",
    "table",
    "theseus",
    "transition between views",
    "tree",
    "unique",
    "value types",
    "view",
    "viewbuilder",
    "view identity",
    "view lifetime",
    "view protocol",
    "view value",
    "view value are ephermal",
    "what does swiftui see"
  ],
  "topics": [
    "SwiftUI & UI Frameworks"
  ],
  "primaryTopic": "SwiftUI & UI Frameworks",
  "duration": 2417,
  "hasTranscript": true,
  "transcriptWordCount": 5828,
  "availableLanguages": [
    "eng",
    "fra",
    "jpn",
    "kor",
    "por",
    "spa",
    "zho"
  ],
  "media": {
    "hls": "https://devstreaming-cdn.apple.com/videos/wwdc/2021/10022/7/72A67717-944A-4D86-BFDD-D1B307C722EC/cmaf.m3u8",
    "downloadHLS": "https://devstreaming-cdn.apple.com/videos/wwdc/2021/10022/7/72A67717-944A-4D86-BFDD-D1B307C722EC/cmaf-download.m3u8",
    "downloadSD": "https://devstreaming-cdn.apple.com/videos/wwdc/2021/10022/7/72A67717-944A-4D86-BFDD-D1B307C722EC/downloads/wwdc2021-10022_sd.mp4",
    "downloadHD": "https://devstreaming-cdn.apple.com/videos/wwdc/2021/10022/7/72A67717-944A-4D86-BFDD-D1B307C722EC/downloads/wwdc2021-10022_hd.mp4",
    "duration": 2417
  },
  "codeSnippets": [],
  "resources": [],
  "path": "sessions/wwdc2021/10022/",
  "files": {
    "metadata": "sessions/wwdc2021/10022/metadata.json",
    "readme": "sessions/wwdc2021/10022/README.md",
    "transcript": "sessions/wwdc2021/10022/transcript.md",
    "transcriptJSON": "sessions/wwdc2021/10022/transcript.json"
  }
}