{
  "schemaVersion": 1,
  "id": "wwdc2019-250",
  "event": "wwdc2019",
  "eventName": "WWDC19",
  "year": 2019,
  "eventContentId": 250,
  "title": "Making Apps More Accessible With Custom Actions",
  "description": "Custom Actions simplify the experience for people using assistive technologies with your app and they can help you reduce the number of swipes and taps that are required to navigate through your interface and perform interactions. Learn how to leverage custom actions for use in VoiceOver and Switch Control. New in iOS 13, bring custom actions to Full Keyboard Access and Voice Control on iOS.",
  "url": "https://developer.apple.com/videos/play/wwdc2019/250",
  "sosumiURL": "https://sosumi.ai/videos/play/wwdc2019/250",
  "type": "Video",
  "publishedAt": "2019-06-04T18:00:00-07:00",
  "platforms": [
    "iOS",
    "iPadOS",
    "macOS"
  ],
  "keywords": [],
  "topics": [
    "SwiftUI & UI Frameworks",
    "Accessibility & Inclusion"
  ],
  "primaryTopic": "Accessibility & Inclusion",
  "duration": 565,
  "hasTranscript": true,
  "transcriptWordCount": 1556,
  "availableLanguages": [
    "eng",
    "fra",
    "jpn",
    "kor",
    "por",
    "spa",
    "zho"
  ],
  "media": {
    "hls": "https://devstreaming-cdn.apple.com/videos/wwdc/2019/250iaz7b18msfiy/250/hls_vod_mvp.m3u8",
    "downloadSD": "https://devstreaming-cdn.apple.com/videos/wwdc/2019/250iaz7b18msfiy/250/250_sd_making_apps_more_accessible_with_custom_actions.mp4",
    "downloadHD": "https://devstreaming-cdn.apple.com/videos/wwdc/2019/250iaz7b18msfiy/250/250_hd_making_apps_more_accessible_with_custom_actions.mp4",
    "duration": 565
  },
  "codeSnippets": [],
  "resources": [],
  "path": "sessions/wwdc2019/250/",
  "files": {
    "metadata": "sessions/wwdc2019/250/metadata.json",
    "readme": "sessions/wwdc2019/250/README.md",
    "transcript": "sessions/wwdc2019/250/transcript.md",
    "transcriptJSON": "sessions/wwdc2019/250/transcript.json"
  }
}