{
  "schemaVersion": 1,
  "id": "wwdc2022-110427",
  "event": "wwdc2022",
  "eventName": "WWDC22",
  "year": 2022,
  "eventContentId": 110427,
  "title": "What's new in Xcode",
  "description": "Discover the latest productivity and performance advancements in Xcode 14. We’ll introduce you to the fully redesigned SwiftUI canvas experience, explore enhancements to code completion and navigation, and take you through performance improvements we’ve made throughout the entire development process. We’ll also show you how you can now read and respond to feedback on your TestFlight builds without ever leaving Xcode.",
  "url": "https://developer.apple.com/videos/play/wwdc2022/110427",
  "sosumiURL": "https://sosumi.ai/videos/play/wwdc2022/110427",
  "type": "Video",
  "publishedAt": "2022-06-07T08:00:00-07:00",
  "platforms": [
    "iOS",
    "iPadOS",
    "macOS",
    "tvOS",
    "watchOS"
  ],
  "keywords": [],
  "topics": [
    "Essentials",
    "Developer Tools"
  ],
  "primaryTopic": "Developer Tools",
  "duration": 1261,
  "hasTranscript": true,
  "transcriptWordCount": 2479,
  "availableLanguages": [
    "eng",
    "fra",
    "jpn",
    "kor",
    "por",
    "spa",
    "zho"
  ],
  "media": {
    "hls": "https://devstreaming-cdn.apple.com/videos/wwdc/2022/110427/5/60E9EBA5-592E-48D0-9429-A85E40C4C9F0/cmaf.m3u8",
    "downloadHLS": "https://devstreaming-cdn.apple.com/videos/wwdc/2022/110427/5/60E9EBA5-592E-48D0-9429-A85E40C4C9F0/cmaf-download.m3u8",
    "downloadSD": "https://devstreaming-cdn.apple.com/videos/wwdc/2022/110427/5/60E9EBA5-592E-48D0-9429-A85E40C4C9F0/downloads/wwdc2022-110427_sd.mp4",
    "downloadHD": "https://devstreaming-cdn.apple.com/videos/wwdc/2022/110427/5/60E9EBA5-592E-48D0-9429-A85E40C4C9F0/downloads/wwdc2022-110427_hd.mp4",
    "duration": 1261
  },
  "codeSnippets": [],
  "resources": [],
  "path": "sessions/wwdc2022/110427/",
  "files": {
    "metadata": "sessions/wwdc2022/110427/metadata.json",
    "readme": "sessions/wwdc2022/110427/README.md",
    "transcript": "sessions/wwdc2022/110427/transcript.md",
    "transcriptJSON": "sessions/wwdc2022/110427/transcript.json"
  }
}