{
  "schemaVersion": 1,
  "id": "wwdc2019-502",
  "event": "wwdc2019",
  "eventName": "WWDC19",
  "year": 2019,
  "eventContentId": 502,
  "title": "Introducing Low-Latency HLS",
  "description": "Since its introduction in 2009, HTTP Live Streaming (HLS) has enabled the delivery of countless live and on‐demand audio and video streams globally. With the introduction of a new Low-Latency mode, latencies of less than two seconds are now achievable over public networks at scale, while still offering backwards compatibility to existing clients. Learn about how to develop and configure your content delivery systems to take advantage of this new technology.",
  "url": "https://developer.apple.com/videos/play/wwdc2019/502",
  "sosumiURL": "https://sosumi.ai/videos/play/wwdc2019/502",
  "type": "Session",
  "publishedAt": "2019-06-04T14:00:00-07:00",
  "platforms": [
    "iOS",
    "iPadOS",
    "macOS",
    "tvOS",
    "watchOS"
  ],
  "keywords": [],
  "topics": [
    "Audio & Video"
  ],
  "primaryTopic": "Audio & Video",
  "duration": 2526,
  "hasTranscript": true,
  "transcriptWordCount": 6386,
  "availableLanguages": [
    "eng",
    "fra",
    "jpn",
    "kor",
    "por",
    "spa",
    "zho"
  ],
  "media": {
    "hls": "https://devstreaming-cdn.apple.com/videos/wwdc/2019/502gzyuhh8p2r8g8/502/hls_vod_mvp.m3u8",
    "downloadSD": "https://devstreaming-cdn.apple.com/videos/wwdc/2019/502gzyuhh8p2r8g8/502/502_sd_introducing_lowlatency_hls.mp4",
    "downloadHD": "https://devstreaming-cdn.apple.com/videos/wwdc/2019/502gzyuhh8p2r8g8/502/502_hd_introducing_lowlatency_hls.mp4",
    "duration": 2526
  },
  "codeSnippets": [],
  "resources": [
    {
      "title": "Enabling Low-Latency HTTP Live Streaming (HLS)",
      "url": "https://developer.apple.com/documentation/HTTP-Live-Streaming/enabling-low-latency-http-live-streaming-hls",
      "type": "documentation",
      "description": "Add Low-Latency HLS to your content streams to maintain scalability.",
      "sosumiURL": "https://sosumi.ai/documentation/HTTP-Live-Streaming/enabling-low-latency-http-live-streaming-hls",
      "doccJSON": "https://developer.apple.com/tutorials/data/documentation/HTTP-Live-Streaming/enabling-low-latency-http-live-streaming-hls.json"
    },
    {
      "title": "HTTP Live Streaming Tools",
      "url": "https://developer.apple.com/download/more/?=hls",
      "type": "download",
      "description": null,
      "sosumiURL": "https://sosumi.ai/download/more/?=hls"
    },
    {
      "title": "HTTP Live Streaming (HLS) authoring specification for Apple devices",
      "url": "https://developer.apple.com/documentation/HTTP-Live-Streaming/hls-authoring-specification-for-apple-devices",
      "type": "documentation",
      "description": "Learn the requirements for live and on-demand audio and video content delivery using",
      "sosumiURL": "https://sosumi.ai/documentation/HTTP-Live-Streaming/hls-authoring-specification-for-apple-devices",
      "doccJSON": "https://developer.apple.com/tutorials/data/documentation/HTTP-Live-Streaming/hls-authoring-specification-for-apple-devices.json"
    }
  ],
  "path": "sessions/wwdc2019/502/",
  "files": {
    "metadata": "sessions/wwdc2019/502/metadata.json",
    "readme": "sessions/wwdc2019/502/README.md",
    "transcript": "sessions/wwdc2019/502/transcript.md",
    "transcriptJSON": "sessions/wwdc2019/502/transcript.json"
  }
}