{
  "$schema": "https://raw.githubusercontent.com/guitaripod/wwdc-sessions/master/schema/session.schema.json",
  "schemaVersion": 1,
  "id": "wwdc2026-121",
  "event": "wwdc2026",
  "eventName": "WWDC26",
  "year": 2026,
  "eventContentId": 121,
  "title": "Announcing Apple’s next big step for Siri and iPhone",
  "description": "Introducing Siri AI in iOS 27, with more power than ever. Transform your images with next-generation AI. Create photorealistic imagery for wallpapers, Contact Posters, and backgrounds across the system in Image Playground. Use a more conversational Siri AI with natural language abilities to edit and write emails, texts, and documents. Keep your personal information safe with Siri AI and update compromised passwords with just a tap.",
  "url": "https://developer.apple.com/videos/play/wwdc2026/121",
  "sosumiURL": "https://sosumi.ai/videos/play/wwdc2026/121",
  "type": "Video",
  "publishedAt": "2026-06-08T14:00:00-07:00",
  "platforms": [
    "iOS",
    "iPadOS",
    "macOS",
    "tvOS",
    "visionOS",
    "watchOS"
  ],
  "keywords": [
    "keynote",
    "keynote 2026",
    "recap"
  ],
  "topics": [
    "Essentials"
  ],
  "primaryTopic": "Essentials",
  "duration": 91,
  "hasTranscript": true,
  "transcriptWordCount": 197,
  "availableLanguages": [
    "eng",
    "fra",
    "jpn",
    "kor",
    "por",
    "spa",
    "zho"
  ],
  "media": {
    "hls": "https://devstreaming-cdn.apple.com/videos/wwdc/2026/121/1/f1e6baa3-3c16-4944-abec-3525818a2702/cmaf.m3u8",
    "downloadHLS": "https://devstreaming-cdn.apple.com/videos/wwdc/2026/121/1/f1e6baa3-3c16-4944-abec-3525818a2702/cmaf-download.m3u8",
    "downloadSD": "https://devstreaming-cdn.apple.com/videos/wwdc/2026/121/1/f1e6baa3-3c16-4944-abec-3525818a2702/downloads/wwdc2026-121_sd.mp4",
    "downloadHD": "https://devstreaming-cdn.apple.com/videos/wwdc/2026/121/1/f1e6baa3-3c16-4944-abec-3525818a2702/downloads/wwdc2026-121_hd.mp4",
    "duration": 91
  },
  "codeSnippets": [],
  "resources": [],
  "path": "sessions/wwdc2026/121-announcing-apple-s-next-big-step-for-siri-and-iphone/",
  "files": {
    "metadata": "sessions/wwdc2026/121-announcing-apple-s-next-big-step-for-siri-and-iphone/metadata.json",
    "readme": "sessions/wwdc2026/121-announcing-apple-s-next-big-step-for-siri-and-iphone/README.md",
    "transcript": "sessions/wwdc2026/121-announcing-apple-s-next-big-step-for-siri-and-iphone/transcript.md",
    "transcriptJSON": "sessions/wwdc2026/121-announcing-apple-s-next-big-step-for-siri-and-iphone/transcript.json"
  }
}
