{
  "schemaVersion": 1,
  "id": "wwdc2022-10115",
  "event": "wwdc2022",
  "eventName": "WWDC22",
  "year": 2022,
  "eventContentId": 10115,
  "title": "What’s new in CloudKit Console",
  "description": "We’ll take you through the latest updates to CloudKit Console and discover how you can explore and debug your containers on the web like never before. Learn more about Act as iCloud, which helps you query records and view data from the perspective of another account. Discover how to share zones of records, and provide better collaboration between participants. And find out how to hide inactive containers. We’ll also share a few tips on getting the most out of CloudKit Console.\n\nTo get the most out of this session, we recommend having basic knowledge of CloudKit containers.",
  "url": "https://developer.apple.com/videos/play/wwdc2022/10115",
  "sosumiURL": "https://sosumi.ai/videos/play/wwdc2022/10115",
  "type": "Video",
  "publishedAt": "2022-06-08T08:00:00-07:00",
  "platforms": [
    "iOS",
    "iPadOS",
    "macOS"
  ],
  "keywords": [],
  "topics": [
    "System Services"
  ],
  "primaryTopic": "System Services",
  "duration": 430,
  "hasTranscript": true,
  "transcriptWordCount": 1083,
  "availableLanguages": [
    "eng",
    "fra",
    "jpn",
    "kor",
    "por",
    "spa",
    "zho"
  ],
  "media": {
    "hls": "https://devstreaming-cdn.apple.com/videos/wwdc/2022/10115/3/76BE7C00-CB67-4FF0-A159-19D8B091CED3/cmaf.m3u8",
    "downloadHLS": "https://devstreaming-cdn.apple.com/videos/wwdc/2022/10115/3/76BE7C00-CB67-4FF0-A159-19D8B091CED3/cmaf-download.m3u8",
    "downloadSD": "https://devstreaming-cdn.apple.com/videos/wwdc/2022/10115/3/76BE7C00-CB67-4FF0-A159-19D8B091CED3/downloads/wwdc2022-10115_sd.mp4",
    "downloadHD": "https://devstreaming-cdn.apple.com/videos/wwdc/2022/10115/3/76BE7C00-CB67-4FF0-A159-19D8B091CED3/downloads/wwdc2022-10115_hd.mp4",
    "duration": 430
  },
  "codeSnippets": [],
  "resources": [
    {
      "title": "Managing iCloud Containers with CloudKit Database App",
      "url": "https://developer.apple.com/documentation/CloudKit/managing-icloud-containers-with-cloudkit-database-app",
      "type": "documentation",
      "description": "Inspect and modify the schema and data for your app’s iCloud container.",
      "sosumiURL": "https://sosumi.ai/documentation/CloudKit/managing-icloud-containers-with-cloudkit-database-app",
      "doccJSON": "https://developer.apple.com/tutorials/data/documentation/CloudKit/managing-icloud-containers-with-cloudkit-database-app.json"
    },
    {
      "title": "CloudKit",
      "url": "https://developer.apple.com/documentation/CloudKit",
      "type": "documentation",
      "description": "Store structured app and user data in iCloud containers that all users of your app can share.",
      "sosumiURL": "https://sosumi.ai/documentation/CloudKit",
      "doccJSON": "https://developer.apple.com/tutorials/data/documentation/CloudKit.json"
    }
  ],
  "path": "sessions/wwdc2022/10115/",
  "files": {
    "metadata": "sessions/wwdc2022/10115/metadata.json",
    "readme": "sessions/wwdc2022/10115/README.md",
    "transcript": "sessions/wwdc2022/10115/transcript.md",
    "transcriptJSON": "sessions/wwdc2022/10115/transcript.json"
  }
}