{
  "schemaVersion": 1,
  "id": "wwdc2026-206",
  "event": "wwdc2026",
  "eventName": "WWDC26",
  "year": 2026,
  "eventContentId": 206,
  "title": "What’s new in managing Apple devices",
  "description": "Discover the latest updates to declarative device management, Apple Business, and Apple School Manager. Explore how these advancements help you streamline deployment, strengthen security, and improve the experience for people using your managed devices. Whether you’re building device management solutions or managing enterprise fleets, you’ll learn practical ways to take advantage of these new capabilities.",
  "url": "https://developer.apple.com/videos/play/wwdc2026/206",
  "sosumiURL": "https://sosumi.ai/videos/play/wwdc2026/206",
  "type": "Video",
  "publishedAt": "2026-06-08T14:00:00-07:00",
  "platforms": [
    "iOS",
    "iPadOS",
    "macOS",
    "tvOS",
    "visionOS",
    "watchOS"
  ],
  "keywords": [
    "enterprise"
  ],
  "topics": [
    "App Store, Distribution & Marketing",
    "Business & Education"
  ],
  "primaryTopic": "Business & Education",
  "duration": 1382,
  "hasTranscript": true,
  "transcriptWordCount": 3139,
  "availableLanguages": [
    "eng",
    "fra",
    "jpn",
    "kor",
    "por",
    "spa",
    "zho"
  ],
  "media": {
    "hls": "https://devstreaming-cdn.apple.com/videos/wwdc/2026/206/4/e49f983e-700d-4d52-ae6b-a0fa1ea89fd0/cmaf.m3u8",
    "downloadHLS": "https://devstreaming-cdn.apple.com/videos/wwdc/2026/206/4/e49f983e-700d-4d52-ae6b-a0fa1ea89fd0/cmaf-download.m3u8",
    "downloadSD": "https://devstreaming-cdn.apple.com/videos/wwdc/2026/206/4/e49f983e-700d-4d52-ae6b-a0fa1ea89fd0/downloads/wwdc2026-206_sd.mp4",
    "downloadHD": "https://devstreaming-cdn.apple.com/videos/wwdc/2026/206/4/e49f983e-700d-4d52-ae6b-a0fa1ea89fd0/downloads/wwdc2026-206_hd.mp4",
    "duration": 1382
  },
  "codeSnippets": [],
  "resources": [],
  "path": "sessions/wwdc2026/206/",
  "files": {
    "metadata": "sessions/wwdc2026/206/metadata.json",
    "readme": "sessions/wwdc2026/206/README.md",
    "transcript": "sessions/wwdc2026/206/transcript.md",
    "transcriptJSON": "sessions/wwdc2026/206/transcript.json"
  }
}