{
  "$schema": "https://raw.githubusercontent.com/guitaripod/wwdc-sessions/master/schema/session.schema.json",
  "schemaVersion": 1,
  "id": "meet-with-apple-236",
  "event": "meet-with-apple",
  "eventName": "Meet with Apple",
  "year": 2025,
  "eventContentId": 236,
  "title": "Hands-on experience with Spatial Audio for Apple Immersive Video",
  "description": "Join David Lebolt from Blackmagic Design to discover how to work with Apple Spatial Audio Format using Fairlight tools. Learn how to setup your session as well as mix, spatialize, and deliver audio correctly with APAC codecs. This session was originally presented as part of the Meet with Apple activity “Create immersive media experiences for visionOS - Day 2.” Watch the full video for more insights and related sessions.",
  "url": "https://developer.apple.com/videos/play/meet-with-apple/236",
  "sosumiURL": "https://sosumi.ai/videos/play/meet-with-apple/236",
  "type": "Video",
  "publishedAt": "2025-12-09T00:00:00-08:00",
  "platforms": [
    "visionOS"
  ],
  "keywords": [],
  "topics": [
    "Spatial Computing"
  ],
  "primaryTopic": "Spatial Computing",
  "duration": 1509,
  "hasTranscript": true,
  "transcriptWordCount": 4110,
  "availableLanguages": [
    "eng",
    "fra",
    "jpn",
    "kor",
    "por",
    "spa",
    "zho"
  ],
  "media": {
    "hls": "https://devstreaming-cdn.apple.com/videos/meet-with-apple/2025/236/3/b3b9141f-229e-4586-a364-c470f2f9d2bf/cmaf.m3u8",
    "downloadHLS": "https://devstreaming-cdn.apple.com/videos/meet-with-apple/2025/236/3/b3b9141f-229e-4586-a364-c470f2f9d2bf/cmaf-download.m3u8",
    "downloadSD": "https://devstreaming-cdn.apple.com/videos/meet-with-apple/2025/236/3/b3b9141f-229e-4586-a364-c470f2f9d2bf/downloads/meet-with-apple-236_sd.mp4",
    "downloadHD": "https://devstreaming-cdn.apple.com/videos/meet-with-apple/2025/236/3/b3b9141f-229e-4586-a364-c470f2f9d2bf/downloads/meet-with-apple-236_hd.mp4",
    "duration": 1509
  },
  "codeSnippets": [],
  "resources": [],
  "path": "sessions/meet-with-apple/236-hands-on-experience-with-spatial-audio-for-apple-immersive-v/",
  "files": {
    "metadata": "sessions/meet-with-apple/236-hands-on-experience-with-spatial-audio-for-apple-immersive-v/metadata.json",
    "readme": "sessions/meet-with-apple/236-hands-on-experience-with-spatial-audio-for-apple-immersive-v/README.md",
    "transcript": "sessions/meet-with-apple/236-hands-on-experience-with-spatial-audio-for-apple-immersive-v/transcript.md",
    "transcriptJSON": "sessions/meet-with-apple/236-hands-on-experience-with-spatial-audio-for-apple-immersive-v/transcript.json"
  }
}
